"CODEA-0105 {h1ra:20}";"1301";"Ávila";"fazer d'ello e en ello todo lo que vós quisiéredes e por bien toviéredes, assí como de vuestro. E para";"se";"complir todo segund dicho es sométome a la jurisdicción de la Eglesia e consiento e dó poder a cualesquier juezes"
"CODEA-0106 {h1ra:34}";"1301";"Ávila";"lo vender a vuestra pro e a nuestro daño fata que vos entreguedes de las penas de cada día que";"se";"ý acrecieren; e las penas pagadas e non pagadas que siempre seamos tenudos de redrar e de sanar, de complir"
"CODEA-0107 {h1ra:20}";"1301";"Ávila";"maravedí de la bona moneda, e la pena pagada o non pagada toda vía que redremos e sanemos. E para";"se";"todo complir segunt dicho es nós todos cuatro los sobredichos Domenga Andrés, la vendedera, e Domingo Andrés, e Martín Domingo"
"CODEA-0108 {h1ra:4}";"1301";"Ávila";"Cornejos, que fue de nuestro padre e de nuestra madre, casas, corrales, solares, tierras, heredades con su pan assí como";"se";"está, heras, prados, pasturas, exidos, fronteras, huertos, linares, montes, defesas, aguas, ríos, arroyos, fuentes, e más si más ý avemos"
"CODEA-0108 {h1ra:29}";"1301";"Ávila";"pena dicha del maravedí de cada día cuantos días de más del plazo passaren. E demás de todo esto para";"se";"mejor complir todos tres los sobredichos doña Joana, e Iváñez Domingo e Domingo Andrés nos sometemos a la jurisdicción de"
"CODEA-0109 {h1ra:15}";"1301";"Ávila";"es tenudo de provar la paga que fiziere fasta dos años, salvo si aquel que á de recebir la paga";"se";"partiere d'esta ley nombradamiente. Fiel desmojonador de todo este heredamiento don Martolomé, fijo de Martín Pérez, dende, que cuanto él"
"CODEA-0110 {h1ra:3}";"1301";"Ávila";"Cornejos, colación de Serranos de Avianos, e que lo recabde para que lo aya el dicho arcidiano por suyo, segunt";"se";"contiene en la carta de la véndida que esta doña Joana fizo d'ello al dicho arcidiano, e esto que lo"
"CODEA-0115 {h1ra:31}";"1301";"Salamanca";"joizio nin fuera de joizio. Esto vos yo el dicho Domingo Martín vendo por poder que trayeron d'ellas assí como";"se";"contiene en una personería que es fecha signada del signo de Andrés Gil, notario de Villa Alba, que mandaron fazer"
"CODEA-0116 {h1ra:18}";"1301";"Ávila";"Muñoz su parte, e d'estas buélvense con el heredamiento de Cilla las seis fronteras, e las otras tres que no";"se";"buelven al dicho heredamiento an por linderos de la una parte la carrera que va a Echamar, e de la"
"CODEA-0116 {h1ra:24}";"1301";"Ávila";"d'estos otro linar que es rastrojo que ovo ý cevada hogaño, que parte con el río. E estos linares todos";"se";"ayuntan con todos nuestros heredamientos de Cilla; e passado el río, assí como va ome a Sant Cristóval en derecho"
"CODEA-0116 {h1ra:27}";"1301";"Ávila";"Sánchez; e otro linar assí como va omne a Sant Cristóval a mano derecha a raíz del olmo por ó";"se";"riegan los linares, de que son linderos Domingo Climente e Pascual Domingo, de Sant Cristóval; e en otro logar en"
"CODEA-0116 {h1ra:28}";"1301";"Ávila";"otro linar, de que es lindero Pascual Domingo, para Xuya; e en el aldea que dizen San dos solares que";"se";"buelven en uno, los cuales solares son en linde de doña Gometiça; estos solares son con su heredamiento assí como"
"CODEA-0116 {h1ra:29}";"1301";"Ávila";"linde de doña Gometiça; estos solares son con su heredamiento assí como parte con doña Gometiça e con Echamar e";"se";"ayunta a lo de Cilla; e cinco arençadas de viñas en dizessiete pedaços que son en Furieles, con dos cubas"
"CODEA-0116 {h1ra:37}";"1301";"Ávila";"tenudo de provar la paga que fiziere fasta dos años, salvo si aquel que la á de recebir la paga";"se";"partiere d'esta ley nombradamiente. E d'aquí adelante nós los dichos Joán Domínguez e María Silvestre damos a vós el dicho"
"CODEA-0116 {h1ra:67}";"1301";"Ávila";"malmeter a vuestra pro e a nuestro daño, fasta que seades entregado de todos los maravedís de las penas que";"se";"ý acrecieren de cada día e que seades creído por nuestra palabra llana sin toda yura por cuanta pendra nos"
"CODEA-0849 {h1ra:5}";"1301";"Huesca?";"Andreu del mes de noviembre; e exament que provadades e paguedes todas messiones que en las ditas eglesias e abadías";"se";"conviene afer, assí como nós d'aquí ad agora cuando las teníamos avemos costumnado pagar e provedir. E sobre todo esto"
"CODEA-0849 {h1ra:19}";"1301";"Huesca?";"Pero, pastor, e Pero Naya e Joán de Pero Bespen, vecinos de Siesso, los cuales presentes fueron e por fianças";"se";"otorgaron e se obligaron en todas cosas ditas desuso. Presentes testimonias Lop Davuero, vecino de Montaragón, e Joán Martíneç de"
"CODEA-0849 {h1ra:19}";"1301";"Huesca?";"Pero Naya e Joán de Pero Bespen, vecinos de Siesso, los cuales presentes fueron e por fianças se otorgaron e";"se";"obligaron en todas cosas ditas desuso. Presentes testimonias Lop Davuero, vecino de Montaragón, e Joán Martíneç de Novales, vecino d'Uesca."
"CODEA-0882 {h1ra:9}";"1301";"Huesca";"voluntat del prebost que por tiempo será que el dito prebost o aquel que la dita prebostría terrá o ministrará";"se";"pueda emparar por su propria autoridat e se empare de las ditas cassas con todos los melloramientos allí feitos a"
"CODEA-0882 {h1ra:9}";"1301";"Huesca";"el dito prebost o aquel que la dita prebostría terrá o ministrará se pueda emparar por su propria autoridat e";"se";"empare de las ditas cassas con todos los melloramientos allí feitos a dreito, e propriedat e possesión de la dita"
"CODEA-0893 {h1ra:5}";"1301";"Navarra?";"al dicho logar de Sant Çalvador de Leire. E sopiendo e entendiendo nós que la gracia e ela almosna que";"se";"da al <mon>asterio de Sant Çalvador de Leire que es <…> servicio de Dios, e a salvamiento de las ánimas"
"CODEA-0121 {h1ra:19}";"1302";"Valladolid";"Fernández. Agora don Pedro, obispo de Ávila, vino a mí e rogóme que porque la carta era de paper e";"se";"rompía, que lo mandasse renovar en pergamino de cuero e seellar con mio seello colgado. E yo por fazer bien"
"CODEA-0122 {h1ra:7}";"1302";"Valladolid";"Arañuelo, que son en el obispado de Ávila, salut e gracia. Sepades que don frey Domingo Suárez, obispo de Ávila,";"se";"me querelló e dize que·l non queredes dar sus diezmos que deve aver en vuestros lugares. E maravíllome mucho porque"
"CODEA-0122 {h1ra:12}";"1302";"Valladolid";"fiz escrevir. Agora don Pedro, obispo de Ávila, vino a mí e mostróme cómo la carta era de paper e";"se";"rompía, e rogóme que gela mandasse dar en pergamino de cuero e seellada con mio seello colgado, e yo tóvelo"
"CODEA-0861 {h1ra:31}";"1302";"Navarra?";"todas e cadaúna d'ellas, assí como escritas e ordenadas son en esta present carta, e pagar e emendar todo cuanto";"se";"puede leyer e entender por esta present carta segund se contiene por las dictas condiciones, e somos de manifiesto. D'esto"
"CODEA-0861 {h1ra:31}";"1302";"Navarra?";"en esta present carta, e pagar e emendar todo cuanto se puede leyer e entender por esta present carta segund";"se";"contiene por las dictas condiciones, e somos de manifiesto. D'esto son testimonias qui presentes fueron e todo esto vieron e"
"CODEA-0861 {h1ra:32}";"1302";"Navarra?";"e somos de manifiesto. D'esto son testimonias qui presentes fueron e todo esto vieron e oyeron e qui por testimonias";"se";"otorgaron: Gonçalvo Çapata, fillo de don Pedro Çapata, e Sancho Xeménez, fillo de don Xemén Aznárez, vezinos de Cintruéñego, e"
"CODEA-2048 {h1ra:2}";"1302";"Valladolid";"todos nuestros fechos. Porque es natural cosa que todo omne que bien faze quiere que gelo lleven adelante e que";"se";"non olvide nin se pierda, que como quier que causse & mingüe el cursso de la vida d'este mundo, aquello"
"CODEA-2048 {h1ra:2}";"1302";"Valladolid";"es natural cosa que todo omne que bien faze quiere que gelo lleven adelante e que se non olvide nin";"se";"pierda, que como quier que causse & mingüe el cursso de la vida d'este mundo, aquello es lo que finca"
"CODEA-2048 {h1ra:13}";"1302";"Valladolid";"boz toviesse, todo el dan o e el menoscabo que por ende recibiéssedes doblado. E ín d'ello mando que todabía";"se";"vos guarde e cumpla lo que en esta mia carta es mandado, e a los mios adelantados merinos & demás"
"CODEA-2049 {h1ra:25}";"1302";"Valladolid";"Ferrández, alcalles de Toledo; Alvar Mun oz e Blascálvaro su fijo, de Ávila, e otros muchos clérigos e legos que";"se";"ý acertaron. Esto fue fecho veinte e un día de junio, era de mill trezientos cuarenta an os, en el"
"CODEA-2067 {h1ra:3}";"1302";"Valladolid";"como dicho <…> Gil López, escrivano público de aquí de Molina, qu'el tenor de la dicha cláusula es este que";"se";"sigue. E mando al cabildo de los clérigos de aquí de Molina la muela e media que yo e Mari"
"CODEA-0671 {h1ra:6}";"1303";"—";"cambiamos vos damos franco e quito, sin otro pecho ninguno con entradas e con salidas, el huerto que al solar";"se";"atiene, con el era, assí como es el que vós a nós dades en cambio d'éste. E dámosvos por fiadores,"
"CODEA-0980 {h1ra:4}";"1303";"Navarra?";"de Ribas, en nopne de Santa María, aquella viña que yo é en el <…> de Biricitu, la coal viña";"se";"tiene e se afruenta de la una part con la viña de don Andreu de Conçoz, el correyero qui fue,"
"CODEA-0980 {h1ra:5}";"1303";"Navarra?";"nopne de Santa María, aquella viña que yo é en el <…> de Biricitu, la coal viña se tiene e";"se";"afruenta de la una part con la viña de don Andreu de Conçoz, el correyero qui fue, e de la"
"CODEA-0980 {h1ra:5}";"1303";"Navarra?";"la una part con la viña de don Andreu de Conçoz, el correyero qui fue, e de la otra part";"se";"tiene e se afruenta con la viña de don <…> de Raso, labrador, e tien de luengo del sendero como"
"CODEA-0980 {h1ra:6}";"1303";"Navarra?";"con la viña de don Andreu de Conçoz, el correyero qui fue, e de la otra part se tiene e";"se";"afruenta con la viña de don <…> de Raso, labrador, e tien de luengo del sendero como entran en las"
"CODEA-1429 {h1ra:23}";"1303";"León";"que nos non vala en juizio nen fuera de juizio, e más que pechássemos cien moravedís de la bona moneda";"se";"vos contra esto passássemos. E que esto sea firme e no venga en dubda dámosvos esta carta sellada con nuestros"
"CODEA-0339 {h1ra:7}";"1304";"Salamanca";"duradero sin fin, que assí durasse aquel regno por siempre jamás. Por ende todo omne que de buena ventura es";"se";"deve siempre membrar d'aquel regno a que á de ir e de lo que Dios le da en este mundo"
"CODEA-0339 {h1ra:35}";"1304";"Salamanca";"e al juez d'esse mismo logar que gelo non consientan e que·l prindren por la pena que en el privilegio";"se";"contiene. E defendemos firmemente que ninguno non sea osado de ir contra este privilegio pora quebrantarlo nin pora minguarlo en"
"CODEA-0340 {h1ra:2}";"1304";"Salamanca";"todos nuestros fechos, porque es natural cosa que todo omne que bien faze quiere que gelo lieven adelante e que";"se";"non olvide nin se pierda, que como quier que causse e mingüe el curso de la vida d'este mundo aquello"
"CODEA-0340 {h1ra:2}";"1304";"Salamanca";"es natural cosa que todo omne que bien faze quiere que gelo lieven adelante e que se non olvide nin";"se";"pierda, que como quier que causse e mingüe el curso de la vida d'este mundo aquello es lo que finca"
"CODEA-0674 {h1ra:7}";"1304";"Burgos";"avedes tomado o peindrado por esta razón entregádgelo luego e non fagades ende ál so la pena que el privilegio";"se";"contiene; e si lo assí fazer non quisierdes mando a don García Ferraz de Villamayor, mio adelantado mayor en Castiella,"
"CODEA-0674 {h1ra:9}";"1304";"Burgos";"esta merced que nós e el rey don Sancho, mio padre, e yo les fazemos segunt que en el privilegio";"se";"contién; e non fagan ende ál por ninguna manera. E d'esto·l mandé dar esta carta sellada con mio sello de"
"CODEA-0717 {h1ra:4}";"1304";"Burgos";"serán d'aquí adelante, salut e gracia. Sepades que Garci Pérez, monge e sacristán del monesterio de Santa María de Nágera,";"se";"me querelló e dize que él que sacara malevado de algunos omnes vuestros vezinos de ý de la villa cera"
"CODEA-0717 {h1ra:15}";"1304";"Burgos";"paga del dicho sacristán o de los que fueren d'aquí adelante si quissieren en vino o en uvas, assí como";"se";"avinieren con él, e que·l dexedes trasmudar el vino a otras bodegas de ý de la villa a él o"
"CODEA-2104 {h1ra:6}";"1304";"Soria";"bienes. Et si por ventura quisieren morar en las villas e en los dichos logares, que moren ý e que";"se";"aprovechen de todo lo suyo bien e complidamientre, assí como mejor e más complidamientre se aprovecharon de lo suyo fasta"
"CODEA-2104 {h1ra:7}";"1304";"Soria";"que moren ý e que se aprovechen de todo lo suyo bien e complidamientre, assí como mejor e más complidamientre";"se";"aprovecharon de lo suyo fasta aquí. Et otrosí otórgoles que si ellos quisieren vender, o empeñar, o camiar, o acomendar,"
"CODEA-0865 {h1ra:7}";"1305";"Navarra?";"an seído siempre en los tiempos passados de la glesia de Sant Pedro de Gaiçarín, la cual glesia es e";"se";"pertenece al abat e al conviento de Sant Çalvador de Leire con todas las pertinencias e con todos sus drechos."
"CODEA-0865 {h1ra:16}";"1305";"Navarra?";"que por obispo nin por ningún otro que non retengamos ni embarguemos las dichas décimas nin los otros drechos que";"se";"pertenecen a la dita glesia, en todo ni en partida. Ante queremos que si ninguno de nós o de nuestros"
"CODEA-0865 {h1ra:37}";"1305";"Navarra?";"e an seído en los tiempos passados de la glesia de Sant Miguell de Marquelaín, la cual glesia es e";"se";"pertenece al abat e al conviento de Sant Çalvador de Leire con todas sus pertinencias e con todos sus drechos."
"CODEA-0865 {h1ra:46}";"1305";"Navarra?";"que por obispo nin por ningún otro que non retengamos ni embarguemos las dichas décimas nin los otros drechos que";"se";"pertenecen a la dicha glesia, en todo ni en partida, ante queremos que si ninguno de nós o de nuestros"
"CODEA-0995 {h1ra:37}";"1305";"Navarra";"les era judgado por la sentencia del governador, segunt que por la sentencia del governador que fue monstrada e leída";"se";"contenía, e que nos pidían por mercé que nós mandássemos dar a execución la dicha sentencia, e que lis ficiéssemos"
"CODEA-0995 {h1ra:43}";"1305";"Navarra";"sentencialment que la dicha sentencia del governador sea dada a execución plenerament en todo e por todo, segunt por ella";"se";"contiene, constreñendo en personas e en bienes a todos aquellos que retienen de aquel tresoro e de aquellos bienes muebles"
"CODEA-0501 {h1ra:15}";"1307";"Valladolid";"vengo e confirmados de mí, que les sean guardados e mantenidos en todo bien e complidamiente segund que en ellos";"se";"contiene. E defiendo firmemente que ningunos non sean osados de ir nin passar contra ellos nin contra ninguna cosa d'ellos"
"CODEA-0596 {h1ra:6}";"1308";"Asturias";"lo tener al dicho monesterio contra sua voluntat. Por ende yo desembárgolleslo e reconóscolo por só por esta carta; e";"se";"ý algún derecho é dólo e ofréscolo al dicho monesterio por mía alma, e tuéllovos a cualesquier o a cualquier,"
"CODEA-0896 {h1ra:28}";"1308";"Navarra?";"ningún tiempo del mundo. E porque el dito atorgamiento e gracia sea firme e valedera pora siempre e revocar non";"se";"pueda en algún tiempo del mundo por alguna raçón, ponemos el siguillo nuestro del dito concello en esta present carta"
"CODEA-0896 {h1ra:30}";"1308";"Navarra?";"del dito concello en esta present carta por testimoniança pendient en cera. Testigos son qui fueron presentes e por testigos";"se";"atorgaron: don Pero Argáiz, clérigo, e don Martín, don Láçaro, vecinos de Sangüessa, e García Sarriá, portero de la cort"
"CODEA-0058 {h1ra:9}";"1309";"Ávila";"cahízes de pan terciado para sembrar; e las viñas que las labredes cada año segund las otras de la eglesia";"se";"deven labrar, e so aquella pena que es puesta por cabildo. E esto todo que sobredicho es que lo cumplades"
"CODEA-0577 {h1ra:2}";"1310";"—";"fecha por Gonçalo Joanes, notario público del rey enna Pobla de Somiedo, e en que seía so signo según que";"se";"enna dicha carta contenía, la cual carta me mostró frey Alfonso, monge del monesterio de Belmonte, e yera fecha en"
"CODEA-0577 {h1ra:4}";"1310";"—";"devemos en Villa <…> e en todos sos términos, assí como lo agora tenemos e como lo possimos, e como";"se";"parti por los términos, assí lo damos e outorgamos a monesterio de Belmonte e a vós don García Pérez, abat,"
"CODEA-0577 {h1ra:17}";"1310";"—";"esta carta leúda el dicho frey Alfonso dixo que avía de mostrar la dicha carta en algunas partes e que";"se";"temía de la perder en alguna manera, e pedió a mí Joán Pérez, escusador ya dicho, que lli diesse el"
"CODEA-0314 {h1ra:17}";"1312";"—";"qui lo oviesse de ver por la orden algún daño tomassen en los molinos, e otrossí si los dichos molinos";"se";"derrequiessen que non moliessen por guerra que sea todo el daño que por estas razones tomássemos descontado por tiempo a"
"CODEA-0897 {h1ra:9}";"1312";"Navarra?";"en Collanços, tierras, viñas, montes, pastos, herbas, aguas, yermo e poblado diezmas todo éntegrament en temporal e espiritual como mejor";"se";"pueda nombrar, declarar e especificar, en tal manera que bien luego de present nós las sobredichas doña Isabel e doña"
"CODEA-0897 {h1ra:20}";"1312";"Navarra?";"seamos oídas en ninguna cort ante ningún juge eclesiástico ni seglar, antes assí como más firmament, sanament e salvament entender";"se";"puede en cualquiere manera aides la dicha Villatorta con sus términos e con todas las cosas sobredichas en temporal e"
"CODEA-0897 {h1ra:30}";"1312";"Navarra?";"contra nós en esta cosa. De todo esto son testigos qui presentes fueron en el logar e qui por testigos";"se";"otorgaron: don Andreu Marzel, don Arnalt Bernart Bergoini e don Estevan el <…>, vezinos de Pomplona, Sancho Périz de Gorraiz,"
"CODEA-0328 {h1ra:24}";"1313";"—";"a los omnes bonos de Portiello que nos lo quieran otorgar e confirmar, e si non en otra manera ermar";"se";"nos ía el logar. E para esto tener e complir el dicho fuero obligamos a nós e a todos nuestros"
"CODEA-0328 {h1ra:28}";"1313";"—";"a Santa María que cualquier e cualesquier de nós que fueren contra esta carta o contra lo que en ella";"se";"contiene en todo o en d'ello que sea maldito de Dios e de Santa María con Judas en el enfierno,"
"CODEA-0600 {h1ra:6}";"1313";"Asturias";"los seellos del dicho Suer Pérez, notario, e de Fernán Pérez, mercador, morador enna dicha pobla en Costa, enna cual";"se";"contenía que García Pérez de la Rúa de Oviedo, alfayate, por nomne de los dichos abat e convento, e la"
"CODEA-0600 {h1ra:12}";"1313";"Asturias";"de Oviedo sobre unos heredamentos en Vigaña ja dicha ennos solos que dizen del Taraño e de Noseral; e que";"se";"obligaran de estar por lo que los dichos mandadores mandassen en este pleito, o el uno d'ellos con que acordasse"
"CODEA-0600 {h1ra:23}";"1313";"Asturias";"al dicho plazo ante los dichos mandadores al dicho logar. E esta Marina Pelaiz dixo que verdat yera que ella";"se";"obligara so la dicha pena de ir al dicho plazo ante los dichos mandadores al dicho logar segunt que enna"
"CODEA-0600 {h1ra:26}";"1313";"Asturias";"mais que fora aquel día enna dicha Pobla ante los dichos mandadores; e el abat dixo que non sabía él";"se";"fora despós del plazo passado, ca al plazo que non fora. E yo el dicho Gutier Gómiz, juiz, pregunté a"
"CODEA-0600 {h1ra:27}";"1313";"Asturias";"passado, ca al plazo que non fora. E yo el dicho Gutier Gómiz, juiz, pregunté a la dicha Marina Péliz";"se";"quería provar que fora al dicho plazo ante los dichos mandadores, o se oviera algún negocio derecho por que non"
"CODEA-0600 {h1ra:28}";"1313";"Asturias";"juiz, pregunté a la dicha Marina Péliz se quería provar que fora al dicho plazo ante los dichos mandadores, o";"se";"oviera algún negocio derecho por que non podiera legar a él, e que la recebiría a esta prova, e ella"
"CODEA-0600 {h1ra:31}";"1313";"Asturias";"al dicho plazo ante los dichos mandadores nin que oviera negocio derecho por que non podiesse ir a él, preguntEles";"se";"querían dizir mais o razonar en este pleito, e ellos dixieron que non, e concluiron ambas las partes en este"
"CODEA-0600 {h1ra:40}";"1313";"Asturias";"mí en juizio, e mandélli que ata nove días llos la pagás por sí e por suas bonas segunt que";"se";"obligó en el compromisso d'este fecho con las costas que fezieron en esta razón. E porque esto sea creúdo e"
"CODEA-1392 {h1ra:25}";"1314";"Zamora";"contra las sus casas. E otrosí frey Yagüe, comendador del monesterio de Sant Mateos de Ávila de la dicha orden,";"se";"me querelló e diz que en el dicho monesterio que ay mojones ciertos que desde los álamos adentro que ninguno"
"CODEA-1392 {h1ra:29}";"1314";"Zamora";"sobredicha, e otrosí el traslado del privillejo del Papa que·l ssea guardado en todo, so la pena que en él";"se";"contiene. E d'esto le mandé dar esta carta seellada con mio seello de cera colgado. Dada en Cipdat Rodrigo, XXII"
"CODEA-1493 {h1ra:3}";"1314";"Logroño";"de Sant Çaluador de Leire an fecho a mí de los lugares de Oteiça e de todas sus pertenencias, segund";"se";"contiene por la carta fecha por mano de Miguel Pérez de Añués, escrivano jurado por el rey en Sangüessa. E"
"CODEA-2423 {h1ra:20}";"1314";"Segovia";"nin otra cosa ninguna por bien que la venta que·l fiz en las Lastras del Pozo que vala assí como";"se";"contiene en la carta que ella tiene en esta razón. Mando a Joán Ferrández, mi sobrino, el mi potro rucio"
"CODEA-2423 {h1ra:42}";"1314";"Segovia";"al deán e al cabillo de todos los algos de Melque, e de Tinada, e de la Gorda, assí como";"se";"contiene en las cartas que son entre mí e ellos, para los capellanes, e aniversarios, e ofrendas, e todas las"
"CODEA-2423 {h1ra:52}";"1314";"Segovia";"tengo por bien que mis herederos que tengan por pagados, e ninguna contienda non aya entre ellos, e que non";"se";"entremetan en los otros mis bienes que yo dexo para complir mi testamento segund dicho es; si non, cualquier de"
"CODEA-0712 {h1ra:8}";"1315";"Burgos";"E que si alguna merced non les fiziesse en razón de la grand cabeça de los pechos que tenían que";"se";"avrían de hermar los del dicho logar e que non sería mio servicio. E yo, con consejo de los dichos"
"CODEA-0712 {h1ra:9}";"1315";"Burgos";"dicho don Joán Alfonso e por facer bien e mercet a los del dicho logar de Bezares e por que";"se";"non yerme e se pueble para mio servicio e puedan coplir los mios pechos, tengo por bien que de los"
"CODEA-0712 {h1ra:9}";"1315";"Burgos";"e por facer bien e mercet a los del dicho logar de Bezares e por que se non yerme e";"se";"pueble para mio servicio e puedan coplir los mios pechos, tengo por bien que de los veinte e dos pecheros"
"CODEA-0718 {h1ra:6}";"1315";"Burgos";"fue de doña Elvira Alfonso de Salinas, que es en Liévana, que nós diemos por camio al dicho monesterio, segund";"se";"contiene en las cartas fechas en razón del dicho camio, catando pro de amas las partes abenímosnos de desatar el"
"CODEA-0718 {h1ra:24}";"1315";"Burgos";"dicho convento obligamos a nós e a los bienes del dicho monesterio de tener, guardar e cumplir todo lo que";"se";"contiene en esta carta. E otrossí nós los dichos don Fernand Ruiz e doña Juana obligamos a nós e a"
"CODEA-0718 {h1ra:26}";"1315";"Burgos";"e doña Juana obligamos a nós e a todos nuestros bienes de tener, e guardar e cumplir todo lo que";"se";"contiene en esta carta. E amas las partes sobredichas revocamos las otras cartas que fueron fechas en razón del dicho"
"CODEA-0892 {h1ra:24}";"1316";"Navarra?";"sehellada con el sihello del señor rey e feicha por mano de Ferrant Sánchez, notario público de Tudela, mas plen<…>ment";"se";"manifiesta. En testimonio de todas las cossas sobredichas, yo Miguel de Salinas, portero antedichos, pongo mio sihello pendient en aquesta"
"CODEA-0892 {h1ra:26}";"1316";"Navarra?";"e possede <…> luego. Son testimonias de aquesto que presentes fueron e esto vieron e oyeron e que por testimonias";"se";"otorgaron son a saber: don Domingo Martín de Fertusán, e don Sancho López de Cascant <…> de <…>, vecinos de"
"CODEA-0581 {h1ra:10}";"1318";"Asturias";"las <…> d'Escanda e la una de segondo desde San Martín ata Natal cuando lo pedir. E a mio finamiento";"se";"ovier quien me levar al monesterio que me soterredes sen otra costa de mí, e se vevier mio hermano Pedro"
"CODEA-0581 {h1ra:11}";"1318";"Asturias";"E a mio finamiento se ovier quien me levar al monesterio que me soterredes sen otra costa de mí, e";"se";"vevier mio hermano Pedro Pérez e quisier estar por esta donación e pletesía que aja la meetat d'este pan e"
"CODEA-0581 {h1ra:14}";"1318";"Asturias";"pletesía que aja la meetat d'este pan e lo soterredes en el dicho monesterio sen otra costa trayéndovoslo ý, e";"se";"non quisier estar por ello que lli desembarguedes la meetat d'esto que vos yo dó para fazer d'ello sua veluntat,"
"CODEA-0581 {h1ra:15}";"1318";"Asturias";"d'esto que vos yo dó para fazer d'ello sua veluntat, e diades a mi la meetat del dicho pan, e";"se";"non venier que lo ajades todo assí como vos lo yo dó. E nós abat e conviento ya dicho otorgamos"
"CODEA-0381 {h1ra:15}";"1319";"Valladolid";"tal manera que nós que lo guardemos bien e lealmientre lo vacuno a toda nuestra costa e lo ovexuno que";"se";"guarde por su razión. E recebimos de vós la dicha doña Especiosa todo este ganado sobredicho, a medias d'este sant"
"CODEA-0381 {h1ra:18}";"1319";"Valladolid";"vindimias fasta cuatro años complidos, e del frucho que Dios en este ganado diere, que la dicha doña Especiosa que";"se";"entregue de lo que fue preciado segunt que sobre dicho es, e después qu'ella fuere entrega, que lo ál todo"
