"CODEA-0578 {h1ra:19}";"1269";"—";"fordes feligreses de la deván decha iglesa nuestro heredamiento fique salvo al monesterio como anti yera si lo assí non";"se";"complissedes <…> decho ye e la pobla ý non posierdes, e que el abat e convento toment desde I solo"
"CODEA-0578 {h1ra:25}";"1269";"—";"tuver heredamientos que pertenescant a rey que non over ganados de rey por cartas por privilegios que el monesterio que";"se";"quite de tal heredamiento sen contienda tan agina que la pobla for ganada del rey, e cuando el concello quiser"
"CODEA-0578 {h1ra:28}";"1269";"—";"monesterio ampararse per cartas o per privilegios, e lo que non defender el monesterio per cartas o per privilegios que";"se";"quite de tal heredamiento el monesterio al concello sen contienda nenguna. Otrossí otorgamos que las gietas de la pobla que"
"CODEA-0578 {h1ra:32}";"1269";"—";"Savastiániz, clérigos, con II monges del monesterio cuales dier el abat e el convento, e si estos cosecedores ja dechos";"se";"non avenerent pararse ante los juizes de la Pobla de Tineo, e como los juizes nos avenerent que lo compliamos"
"CODEA-0578 {h1ra:36}";"1269";"—";"nuestro jurado non quiser caber esti pleito e esti convén sobredecho nós jurados sobredechos otorgamos de tener con monesterio que";"se";"complia esti pleito e esti convén pel rey e por don Gutierre, nós con monesterio e el monesterio connusco. E"
"CODEA-0870 {h1ra:16}";"1269";"Navarra?";"E prometiéronse l´abat a don Lop de Pomar e don Lop de Pomar al abat de jus bona fe que";"se";"tengan en la palavras que desuso son escritas a aquell plazo que ellos porrán. E por tal que estas cosas"
"CODEA-0423 {h1ra:3}";"1270";"León";"esta mi carta vierdes, salut e gracia. El abat de Sant Andrés de Espinareda por sí e por so convento";"se";"me envió querellar e diz que cuando quemara la su eglesia que quimaran ý los privilegios que avié el monesterio,"
"CODEA-0423 {h1ra:9}";"1270";"León";"del monesterio en Villa Franca, e fallé que en Vega, nen en Buruea, nen en Fernella non fazían foro ninguno";"se";"non moneda. Otrossí fallé que en el coto del monesterio non entrava merino a ninguna cosa se non a cuatro"
"CODEA-0423 {h1ra:10}";"1270";"León";"fazían foro ninguno se non moneda. Otrossí fallé que en el coto del monesterio non entrava merino a ninguna cosa";"se";"non a cuatro cosas, a camino britado, a mugier forçada, e a levoso e a ladrón coñosçudo, e de cuanto"
"CODEA-0423 {h1ra:13}";"1270";"León";"del coto e que los omnes del coto davan martinega a mí e que levava el abat la meatat d'ella";"se";"non d'estas tres villas sobredichas de que·l non davan foro ninguno se non moneda. E d'estas cosas sobredichas algunos d'ellos"
"CODEA-0423 {h1ra:14}";"1270";"León";"e que levava el abat la meatat d'ella se non d'estas tres villas sobredichas de que·l non davan foro ninguno";"se";"non moneda. E d'estas cosas sobredichas algunos d'ellos viron los privilegios e d'ellos oíron dizer que los avién e todos"
"CODEA-0463 {h1ra:12}";"1270";"—";"e la possessión de todo ayades, possideades, donedes, vendades, fagades toda vossa voluntade, assí ena vida como ena morte; e";"se";"eu Martín Migael, dessuso dito, ou algún ome de la mia parte esta carta de vendizón contradizer quiser seya maldito"
"CODEA-0484 {h1ra:2}";"1270";"Toledo";"alguazil de Toledo, salut e gracia. Sepades que el abbat e el convento del monesterio de San Climent de Toledo";"se";"nos embiaron querellar e dizen que cuando les arriendan los moros aquellas sus tiendas de la farina que el monesterio"
"CODEA-0856 {h1ra:23}";"1272";"Navarra?";"fuero de Tudela, de amas llas partidas con pena, que faga dar CC soldos de sanchetes at aquella partida que";"se";"rependir se quisiere e saber don Per Açnareç, fi don Açnar de Montacut. E yo dicto don Per Açnareç otórgome"
"CODEA-0856 {h1ra:24}";"1272";"Navarra?";"Tudela, de amas llas partidas con pena, que faga dar CC soldos de sanchetes at aquella partida que se rependir";"se";"quisiere e saber don Per Açnareç, fi don Açnar de Montacut. E yo dicto don Per Açnareç otórgome por tal"
"CODEA-0856 {h1ra:26}";"1272";"Navarra?";"E yo dicto don Per Açnareç otórgome por tal fiador e son de manifiesto por amas las partidas por meno<…>sas";"se";"promitieron Ferrán Elias, Semén Justicia."
"CODEA-0954 {h1ra:12}";"1272";"Huesca?";"benigneça de doña Cipressa, muller del dito Juan don Julián, e cosirando la so neçessitat; catando encara como ella benignament";"se";"sotmisso a la nuestra sentencia ensemble con el dito procurador de su marido, por que nós árbitros aván ditos, aviendo"
"CODEA-0044 {h1ra:5}";"1273";"Toledo";"obispo e el cabildo con el concejo de Ávila, de villa e de aldeas, sobre los escusados del coro que";"se";"querellavan que escusavan muchos e que era grant agraviamiento de los pecheros, fizieron tal abenecia entre sí que cuarenta moços"
"CODEA-0457 {h1ra:7}";"1273";"—";"de vós de todo este precio ben pagados, que fagades d'esta viña que queserdes a vida e a morte, que";"se";"algum omne de nossa parte ou d'extrana a vós ou a vossa parte esta carta passar ou britar, dóblevos esta"
"CODEA-0538 {h1ra:2}";"1273";"Toledo";"Andrés e a vuestra mugier, doña María, la nuestra tienda que avemos a la puerta de Santa María, la cual";"se";"tiene de las dos partes con nuestras tiendas de la eglesia dicha e de la otra la plaça ó están"
"CODEA-0585 {h1ra:12}";"1273";"León";"e demáis obligámosnos las partes e diemos poder al deán sobredicto que nos <…><…> por sua auctoridade e nos escomungasse";"se";"non estovéssemos a ello que él mandasse e renunciamos a todo outro mandado e a todo outro juizo que entre"
"CODEA-0585 {h1ra:14}";"1273";"León";"entre nós fura sobre este pleito por todos juizos ou <…> ou arbidios; e entón logo dixo el deán que";"se";"nos non pudiesse avenir que desampararía el pleito e peró finalmente logo dixo qu'ello non quería desemparar a menos de"
"CODEA-0586 {h1ra:16}";"1273";"León";"portero, e estos dieros mando qu'ellos día el abat ata XV días salvo ende III moravedís que despendió Fernán Sorveda";"se";"el personero de Joán García ou Joán García non contradixere este mandado, e se lo contradixese non ye mando dar"
"CODEA-0586 {h1ra:17}";"1273";"León";"III moravedís que despendió Fernán Sorveda se el personero de Joán García ou Joán García non contradixere este mandado, e";"se";"lo contradixese non ye mando dar ellos dieros sobredictos. E por este escrito descomungo al abat se a este mandado"
"CODEA-0586 {h1ra:18}";"1273";"León";"este mandado, e se lo contradixese non ye mando dar ellos dieros sobredictos. E por este escrito descomungo al abat";"se";"a este mandado non estever, outro si descomungo a Joán García se a ese mandado non estever. E ajulgo la"
"CODEA-0586 {h1ra:19}";"1273";"León";"sobredictos. E por este escrito descomungo al abat se a este mandado non estever, outro si descomungo a Joán García";"se";"a ese mandado non estever. E ajulgo la propriedade e la possessión d'esta iglesia de Palacios <s>obredicta con todos sous"
"CODEA-0586 {h1ra:20}";"1273";"León";"ajulgo la propriedade e la possessión d'esta iglesia de Palacios <s>obredicta con todos sous derechos al abat de Sant Andrés";"se";"Joán García non estevier <…> yo mando, e demáis mando que todos juizos e todos arbridios e todas sentencias que"
"CODEA-0586 {h1ra:30}";"1273";"León";"de verdade. E mandóume el deán sobredicto que desse a Joán García ou a sou procurador outro estrumento como esto";"se";"lo quisier. Fecho fu esto era e mes e día sobredictos. Presentes: Malendo Ordoñez, canóligo, Martín Pelaiz e Fernán Martínez,"
"CODEA-0857 {h1ra:2}";"1273";"Navarra";"e paz e concordia sea criada e materia de discordia e de pleitear sea tollida, e porque las cosas que";"se";"fazen en present e por alongamiento de tiempo non vengan en dubda sobre contienda que era o <…> seer entre"
"CODEA-0889 {h1ra:7}";"1273";"Navarra?";"esta comienda que vós doña Ferrera sobrenopnada tenedes de la orden sobredicha. E yo doña Ferrera otorgo todo lo que";"se";"continúa desuso en esta carta de atener planament sines contradicho ninguno. E porque este fecho sea firme e non venga"
"CODEA-0428 {h1ra:8}";"1274";"—";"mulinus vos dou e vos entergo, como desusu ye ditu, que vendades, e donedes e fazades d'elos toda vosa voluntat.";"Se";"algún omne de mia parte ou de la estrania contra esta donación quesier pasar ou you pasase aya ela ira"
"CODEA-0528 {h1ra:14}";"1274";"—";"por nós e por nuestras bonas de vos amparar con él a todo tiempo de quienquier que volo demande, e";"se";"por aventura algún de nuestra parte o de otra contra esta vención quiser vinir o pasar en ninguna manera, aya"
"CODEA-0619 {h1ra:22}";"1274";"Sevilla";"qui quisiere oír ý oras que las pueda oír, e que puedan recebir a sepultura todos aquellos e aquellas que";"se";"quisieren ý conterrar, sacando ende de la perroquia de Santa María de Sevilla de la cual de derecho non puede"
"CODEA-0619 {h1ra:24}";"1274";"Sevilla";"cual de derecho non puede en otro logar escoger sepultura sin nuestra licencia, sacando ende freile o con freile que";"se";"deve conterrar con su orden, e de todas las mandas que mandaren a aquella eglesia o a la orden con"
"CODEA-0619 {h1ra:26}";"1274";"Sevilla";"el paño que viniere sobre el ataúd que finque todo a la orden, e cuando acaeciere que vezino de Sevilla";"se";"mandare enterrar en la dicha eglesia de Santiago que ayamos nós e nuestro cabillo la tercera parte de todas las"
"CODEA-0653 {h1ra:23}";"1274";"Sevilla";"qui quisiere oír ý oras, que las pueda oír. E que puedan recebir a sepultura todos aquéllos e aquéllas que";"se";"quesieran ý enterrar, sacado ende de la perroquia de Santa María de Sevilla, de la cual de derecho non puede"
"CODEA-0653 {h1ra:24}";"1274";"Sevilla";"la cual de derecho non puede en otro lugar escoger sepultura sin nuestra licencia, sacado ende freile o confreile que";"se";"<…> enterrar en su orden. E de todas las mandas que mandaren aquella eglesia o a la orden con el"
"CODEA-0653 {h1ra:27}";"1274";"Sevilla";"el paño que viniere sobre el ataúd que finque todo a la orden. E cuando acaeciere que vezino de Sevilla";"se";"mandare enterrar en la dicha eglesia de Santiagüe que ayamos nós e nuestro cabillo la tercera parte de todas las"
"CODEA-2348 {h1ra:4}";"1274";"Castellón";"sus vezinos, que pareciessen ante los alcaldes de ý, et que passasse el pleito primeramente por ellos, et desi qui";"se";"agraviasse de su juizio, que le diessen el alçada como es fuero et derecho. Et yo, entendiendo que es derecho"
"CODEA-0040 {h1ra:4}";"1275";"Valladolid";"ricos omnes, don Sancho, arçobispo de Toledo, mio tío, e con los otros prelados de Castiella e de León, que";"se";"ý acertaron, mostráronme cosas que dizién que eran a grand agraviamiento d'ellos e de sus eglesias e de su clerecía;"
"CODEA-0295 {h1ra:23}";"1275";"—";"día por alma de nuestro padre, e de nuestra madre, e de nós mismos e de nuestras mugieres las que";"se";"en vuestro monesterio quisieren entrar, e todo el heredamiento sobredicho e estos mil moravedís vos damos que fagades un altar"
"CODEA-0571 {h1ra:7}";"1275";"Asturias";"fagades ende toda vuestra voluntat a todo tiempo; e yo guaridor a todo tiempo per mi e per mias bonas,";"se";"d'alquien de mia progenia o d'estraña, esti mio fecho quisier corromper seja maldito de Dios, e escomungado, e pol temporal"
"CODEA-0806 {h1ra:9}";"1275";"Huesca";"estant en Quicena, e nós con éll ensemble, e cadaún por el tot, qui por fiança de salvedat en continent";"se";"atorgó así a la pagada pan e vino e carne. Testimonias son d'esto: Bonanat, adobador, vecino d'Osca e García de"
"CODEA-0846 {h1ra:13}";"1275";"Huesca";"nós a vós el dito quinión, que si en el dito término non pagáredes el dito treúdo segunt que desuso";"se";"contenexe, que el prebostre de Montaragón qui por tiempo será por su propria actoridat senes todo judicio e calonia, se"
"CODEA-0846 {h1ra:14}";"1275";"Huesca";"se contenexe, que el prebostre de Montaragón qui por tiempo será por su propria actoridat senes todo judicio e calonia,";"se";"pueda emparar del dito quinión con todos los melloramientos allí feitos e con todos aquellos convenios vendemos nós a vós"
"CODEA-0846 {h1ra:17}";"1275";"Huesca";"e fillos e fillas vostras e toda vostra generación por todos tiempos, assí como de véndeda más firme e sanament";"se";"puede dezir, entender e pensar a pro, e a bien e a salvamiento vostro; e dámosvos fiança de salvedat e"
"CODEA-0846 {h1ra:19}";"1275";"Huesca";"e senes mala voç, vós cumpliendo las cosas desuso ditas Pedro don Guilliamón, ciutadano de Osca, el cual de present";"se";"atorgó por fiança e nós con éll ensemble a vueltas. Testimonias son d'esto don Joán d'Oliván e Domingo Allión, ciutadanos"
"CODEA-0045 {h1ra:11}";"1276";"Burgos";"los Poyales de Valdeyusta, e dent por fondón de los Sarçalejos como va derechamient a la cabeça de Navalpuerco, ó";"se";"començó el primer mojón. Este heredamiento por los logares sobredichos entergamos al alverguería de Valdeyusta. E porque esto sea cierto"
"CODEA-0380 {h1ra:6}";"1276";"León";"de Vega en salvo, e el plazo de la primera paga deve a seer a esta Natal primera que verná,";"se";"recebirdes ante los fruchos, e se los non recebirdes non pagada es ata que los recibades éntregamientre sien escatima. E"
"CODEA-0380 {h1ra:6}";"1276";"León";"plazo de la primera paga deve a seer a esta Natal primera que verná, se recebirdes ante los fruchos, e";"se";"los non recebirdes non pagada es ata que los recibades éntregamientre sien escatima. E estos moravedís devedes a pagar cada"
"CODEA-0380 {h1ra:9}";"1276";"León";"en aquella que ficar viva, e después que ambas finaren fique toda la renda éntregamientre pora vistiario del convento. E";"se";"por aventura non pagardes a estos plazos, segundo que desuso dicho ye, prometedes de dar a ellas o a so"
"CODEA-0380 {h1ra:13}";"1276";"León";"recebides o en meyor. E non vos devemos a toler aqueste arrendamiento por otro nenguno nen pora nós mismas, e";"se";"por aventura contra ello veniéssemos otorgamos de vos pechar docientos moravedís de los blancos por pena; e la pena pagada"
"CODEA-0380 {h1ra:14}";"1276";"León";"pagada toda vía e la renda seer firme. E a vuestro finamiento que todas estas cosas que vos arrendamos que";"se";"tornen livres e quitas al juro e al señorío del monesterio con las meyorías que ý ficierdes. E yo Domingo"
"CODEA-0380 {h1ra:21}";"1276";"León";"ellas mía siñal en testimonio de verdat. E nós priora, e prior e convento de Monester de Vega otorgamos que";"se";"por aventura, cosa que Dios non mande, esta casas que arrendamos a vós, Domingo Aparicio pereciesen per fuego que vós"
"CODEA-0580 {h1ra:20}";"1276";"Burgos";"este pleito por juizo, ambas las partes pedíronme por merced que me ploguiés e que ellos farían entre sí avenencia";"se";"lo fazer podiessen, e yo tóvelo por bien, e ambas las partes aveniéronse en tal manera que el abat e"
"CODEA-0875 {h1ra:11}";"1276";"—";"aquéllas todas vuestras proprias voluntaç assí como de cosa vuestra proprias, e assí como mellor e más sanament e provectosa";"se";"puede dezir o entender cosa de pura e verdadera vendición gitando a nós de present e a todos los nuestros"
"CODEA-0875 {h1ra:19}";"1276";"—";"fidançaria antedita cadaúno de nós por el todo femos e otorgamos en todas cosas e por cadaúnas assí como desuso";"se";"contenexe. Aliala pagada XII soldos. Testimonios son d'esto qui fueron presentes e rogados: don Pedro Maça e don García Pueyo,"
"CODEA-0876 {h1ra:16}";"1276";"—";"en aquélla todas vuestras proprias voluntaç vós e toda vuestra generación pora todos tiempos assí como mellor e más sanament";"se";"puede decir o entender cosa de pura donación. E por mayor firmeça e testimoniança de las sobreditas cosas, nuestros signos"
"CODEA-0877 {h1ra:14}";"1276";"—";"en aquéll todas vuestras proprias voluntaç vós e toda vuestra generación pora todos tiempos, assí como mellor e más sanament";"se";"puede decir o entender cosa de pura donación. E por mayor testimoniança de las sobreditas cosas, nuestros signos acostumnados aquí"
"CODEA-0877 {h1ra:18}";"1276";"—";"meter e aver metudo en lo dito molino en melloramiento los ditos CCC soldos al dito término segunt como desuso";"se";"contenexe. E ad esto atender e complir obligamos a vós, a nós mismos e todos nuestros bienes sedientes e movientes,"
"CODEA-0878 {h1ra:14}";"1276";"—";"assí como de cosa vuestra propria vós e toda vuestra generación pora todos tiempos, assí como mellor e más sanament";"se";"puede decir o entender cosa de pura donación. E por mayor firmeça e testimoniança de las sobreditas cosas, nuestros signos"
"CODEA-0766 {h1ra:8}";"1277";"Teruel";"por mí dius scripto lo verán e ordenado será. Proméndome por mi ánima e de los bienes míos esto que";"se";"sigue: Primerament, toda mi sepultura de lienço e de cera e la mi <…> acostumbrada e al vicario II soldos"
"CODEA-0766 {h1ra:9}";"1277";"Teruel";"e de cera e la mi <…> acostumbrada e al vicario II soldos por sus derechos; item a cuantos clérigos";"se";"acercaran a la mi sepultura cada XII dineros, e que digan sendas misas de requiem por mi ánima; item a"
"CODEA-0766 {h1ra:15}";"1277";"Teruel";"antes de Sant Bartolomé del mes de agosto por cadáun año e por todos tiempos, e que aquell día que";"se";"fará el dicho aniversario que aquel día sean tenidos mi muger o mis fijos o detenedores del dicho huerto pagar"
"CODEA-0766 {h1ra:17}";"1277";"Teruel";"la dicha eglesia que por el detenedor del dicho huerto sean dados aquell año los dichos IIII soldos que non";"se";"fará el dicho aniversario por amor de Dios <…> de <…> do a ellos bien aquesto será. Item quiero e"
"CODEA-0766 {h1ra:30}";"1277";"Teruel";"de Silvestre de Calcena asín como a fijos e herederos legítimos que son míos, los cuales quiero e mando que";"se";"los partan por eguales partes. E ésta es mi última voluntat. fue en Ruvihuelos, XVI días andados del mes de"
"CODEA-1238 {h1ra:13}";"1278";"Zamora?";"e otorgo que yo nen otre por razón de mí non seamos poderosos de vos demandar a nengún tiempo. E";"se";"por aventura yo o alguno de mios herederos contra esta carta o contra este mio fecho quissiesse passar o contradezir"
"CODEA-0807 {h1ra:10}";"1279";"Huesca";"prometo e conviengo a vós dar e pagar el dito trevudo quiscun año en el dito término assí como desuso";"se";"contenexe. Testimonias son d'esto: don Pelegrín de Castiello, clérigo, e don Ramón de Forniellos e don Domingo Quicena, habitadores de"
"CODEA-0864 {h1ra:17}";"1279";"Navarra?";"al nuestro mandamiento cada <…>, a saber, que si doña Oria sobredicha finás ante que don Pedro, que don Pedro";"se";"deve ir luego al monasterio de Sant Salvador e de rendar todo el mueble e todos los bienes que ambos"
"CODEA-0780 {h1ra:5}";"1281";"—";"que vós que lo ayades, possedeades, vendades, donedes, empenedes, fagades d'elo toda vuestra volontad assí ena vida como ena morte.";"Se";"per aventura yo o alguno de mios heredes contra esta carta e contra esta donación que vos yo fago quisier"
"CODEA-0847 {h1ra:13}";"1281";"Huesca";"casas por dar, vender, alienar e por fer a toda vostra propria voluntat agora e todos tiempos como mellor decir";"se";"puede a todo salvamiento vostro. Yo dito Salvador el dito casas e plaça recibo con el dito treúdo e condiciones"
"CODEA-0977 {h1ra:4}";"1281";"Navarra";"deve ser quitament de lur monasterio por donatión de los reyes, e que an usado de todos tiempos que ombre";"se";"pueda acordar de poner e de desponer alcalde a toda lur voluntat en la dicha villa de Carcastiello, e el"
"CODEA-0047 {h1ra:6}";"1282";"Valladolid";"obispo e el cabildo con el concejo de Ávila, de villa e de aldeas, sobre los escusados del coro, que";"se";"querellavan que escusavan muchos e que era grand agraviamiento de los pecheros, fizieron tal abenencia entre sí que cuarenta moços"
"CODEA-0047 {h1ra:22}";"1282";"Valladolid";"en ninguna manera, ca cualquier que lo fiziesse pechar m'ie la pena que en la carta del rey mio padre";"se";"contiene e al cabildo todo el daño doblado; e demás a él e a cuanto oviesse me tornaría por ello."
"CODEA-0531 {h1ra:8}";"1282";"Burgos";"Añana, que son heredat de so monesterio segund que lo an otros monesterios de mi gracia; e la sal que";"se";"levanta de aquellas eras que la levaron en tiempo del rey don Alfonso, mio visavuelo, e en tiempo del rey"
"CODEA-0579 {h1ra:1}";"1282";"—";"De derecho e de raçón ya que todas las cosas que";"se";"vienden nen por aventura venan a oblidancia e que se confirmen por letras, por esso, yo Allonça González e yo"
"CODEA-0579 {h1ra:1}";"1282";"—";"derecho e de raçón ya que todas las cosas que se vienden nen por aventura venan a oblidancia e que";"se";"confirmen por letras, por esso, yo Allonça González e yo Mayor González, fillas de don Gonzalo Fernández de Lodón e"
"CODEA-0579 {h1ra:7}";"1282";"—";"logar nomnado en Vilaguiceo que yaz en término de Salcedo, salvo ela meatat que tien Diego Fernández e salvo el";"se";"ismo que vendió Menén de Nalso o dio al monesterio de Balmonte; vendémosvos cuanto heredamiento nós avemos e devíamos a"
"CODEA-0579 {h1ra:21}";"1282";"—";"todas nuestras bonas tan bien moble como raíz de vós asal siempre este heredamiento, assí como desuso ya terminado. E";"se";"dalguno omne, tan bien de la nuestra parte como de la allena, veniés o quisiés venir contra este nuestro fecho"
"CODEA-1495 {h1ra:19}";"1282";"Navarra";"per tal fiança com denant dit es per les dos partides, a la cual fiança les partides cadaúna per sí";"se";"obligaren de traire de tot daun d'esta fiancería sobre totz lurs bens mobles e heredatz or que sien. Testimonis son"
"CODEA-0008 {h1ra:14}";"1283";"Valladolid";"a amas estas dichas partes de costas e de travajos, fue merced de la reina doña Joana, mi muger, que";"se";"fiziesse la dicha prueva y en la dicha su villa de Guadalfajara, e encomendó la recepción de los testigos e"
"CODEA-0008 {h1ra:25}";"1283";"Valladolid";"e donzellas e clérigos que dichos son e de cada uno de ellos es provado cuanto cumple en aquello que";"se";"avían ofrecido e devían provar en razón de aquello que por la su parte fue dicho e allegado contra los"
"CODEA-0008 {h1ra:48}";"1283";"Valladolid";"mandásemos guardar e complir la sobredicha carta de sentencia del dicho rey nuestro padre, en todo segunt que en ella";"se";"contiene. E nós toviémoslo por bien e mandamos que les vala e sea guardada, e complida e mantenida en todo"
"CODEA-0008 {h1ra:49}";"1283";"Valladolid";"mandamos que les vala e sea guardada, e complida e mantenida en todo bien e complidamente segunt que en ella";"se";"contiene e segunt que mejor e más complidamente les fue guardada, e complida e mantenida en tiempo del dicho rey"
"CODEA-0008 {h1ra:50}";"1283";"Valladolid";"de les ir nin passar contra ella nin contra parte d'ella en alguna manera, so la pena que en ella";"se";"contiene. E d'esto les mandamos dar esta nuestra carta escrita en pargamino de cuero e sellada con nuestro sello de"
"CODEA-0048 {h1ra:9}";"1283";"Ávila";"con Serranos de Avianos, e dende por somo de Nava Astellar, e dende a somo del Verrueco de Mazgañán ó";"se";"comiença el primero mojón. Esto todo sobredicho con el término dicho desuso damos e otorgamos a Velasco Velásquez el sobredicho"
"CODEA-0048 {h1ra:17}";"1283";"Ávila";"le sirvan e le obedezcan e le fagan todas las cosas que vassallos solariegos deven fazer a señor. E que";"se";"sirvan e se ayuden e se aprovechen de nuestros montes e de nuestros pastos, e de nuestros términos bien e"
"CODEA-0048 {h1ra:17}";"1283";"Ávila";"le obedezcan e le fagan todas las cosas que vassallos solariegos deven fazer a señor. E que se sirvan e";"se";"ayuden e se aprovechen de nuestros montes e de nuestros pastos, e de nuestros términos bien e complidamentre en pacer"
"CODEA-0048 {h1ra:17}";"1283";"Ávila";"le fagan todas las cosas que vassallos solariegos deven fazer a señor. E que se sirvan e se ayuden e";"se";"aprovechen de nuestros montes e de nuestros pastos, e de nuestros términos bien e complidamentre en pacer e en cortar"
"CODEA-0330 {h1ra:12}";"1284";"Valladolid";"en otro logar me yo mandasse enterrar o me enterrassen que vos dé los mil moravedís sobredichos doblados e que";"se";"partan en esta guisa: los mil e quinientos moravedís para pro del monesterio e los quinientos moravedís para'l rey. E"
"CODEA-0330 {h1ra:20}";"1284";"Valladolid";"rendiere los cient e treinta moravedís lo que ende menguare que lo cumplamos de lo del monesterio en guisa que";"se";"cumplan cada año los cient moravedís para pescado en la Cuaresma e los treinta moravedís para'l el día del añiversario."
"CODEA-1113 {h1ra:5}";"1284";"Zamora";"los frades predicadores de ý de Salamanca dólles que ayan un escusado ý en la villa e que tomen cual";"se";"quesieren; e yo escúsolo de todo pecho, de fonsadera e de fonsado, e de todo pedido, e de todo servicio,"
"CODEA-1111 {h1ra:6}";"1285";"Toledo";"obispo e el cabildo con el concejo de Ávila de villa e de aldeas sobre los escusados del coro, que";"se";"querellavan que escusavan muchos, e que era grant agraviamiento de los pecheros, fizieron tal abenencia entre sí que cuarenta moços"
"CODEA-1111 {h1ra:18}";"1285";"Toledo";"en ninguna manera, ca cualquier que lo fiziesse pechar m'ie la pena que en la carta del rey mio padre";"se";"contiene, e al cabildo todo el daño doblado, e demás a él e a cuanto oviesse me tornaría por ello."
